{
  "critic": "foundation-critic",
  "plugin": "O-simpleBeatmaker",
  "stage": "4-polish",
  "attempt": 1,
  "maxAttempts": 3,
  "timestamp": "2026-06-25T00:00:00Z",
  "scores": {
    "cmake_correctness": {
      "score": 9,
      "threshold": 8,
      "passed": true,
      "details": "juce_add_plugin() complete: PRODUCT_NAME, COMPANY_NAME, PLUGIN_MANUFACTURER_CODE (OuDv dev / OuAu release, both project-standard; auval confirms OuDv), PLUGIN_CODE OSiB (unique across the suite), FORMATS VST3 AU Standalone, IS_SYNTH TRUE, NEEDS_MIDI_INPUT TRUE, NEEDS_MIDI_OUTPUT FALSE. WebView flags correct: NEEDS_WEBVIEW2 TRUE (line 23) + JUCE_USE_WIN_WEBVIEW2_WITH_STATIC_LINKING=1 (line 97) + NEEDS_WEB_BROWSER TRUE + JUCE_WEB_BROWSER=1. All 12 target_sources files and all 5 UI binary-data resources exist on disk. Exactly ONE juce_add_binary_data target (O-simpleBeatmaker_UIResources); BeatPresets.h is a constexpr header, not a blob, so the O-simpleGrain dual-namespace collision does not apply. -1 only for a cosmetic stub inconsistency in the test harness CMake (manufacturer-code macro is 'Ouar', not OuAu/OuDv) which has zero functional impact."
    },
    "apvts_integration": {
      "score": 10,
      "threshold": 7,
      "passed": true,
      "details": "createParameterLayout() declares exactly 42 params: 5 global (swing, humanize, quantizeStrength, patternLength choice {8,16,32}, tempo 40-240) + 36 per-voice (6 voices x Tune/Decay/Tone/Level/Mute/Solo) + 1 master (outputLevel). Every ID, type, range, and default matches parameter-spec.md precisely (swing/humanize default 0.0, quantizeStrength 1.0, patternLength idx 1 = 16, tempo 120, Tune +/-12 st default 0, Decay/Tone 0-1 default 0.5, Level/outputLevel -60..0 dB default 0, Mute/Solo bool false). Contract frozen this stage: applyConceptPreset() writes only existing params (via setValueNotifyingHost) plus the non-APVTS atomic grid; no params added and no defaults changed."
    },
    "build_health": {
      "score": 10,
      "threshold": 8,
      "passed": true,
      "details": "Gathered evidence (clean VST3+AU+Standalone+render-test build, render-harness 11/11 probes PASS, auval aumu OSiB OuDv SUCCEEDED, pluginval strictness-10 SUCCESS for VST3+AU) re-verified at the build-graph level: VST3/AU/Standalone targets all resolve in the configured Ninja build (dev-suffixed artefacts present, confirming the OuDv path); ninja -n on all three reconfigured CMake cleanly with no errors. createEditor symbol resolves in both build modes (WebView editor under JUCE_WEB_BROWSER=1, GenericAudioProcessorEditor under =0)."
    },
    "module_integration": {
      "score": 10,
      "threshold": 6,
      "passed": true,
      "details": "OuariconModules.cmake included correctly (CMakeLists line 3); OUARICON_COMPANY_NAME / OUARICON_MANUFACTURER_CODE / OUARICON_DEV_SUFFIX resolve from the root CMakeLists branding block with no version conflicts. Plugin uses no shared Ouaricon C++ code modules (self-contained header-only DSP spine), so no module path/signature/version drift is possible."
    }
  },
  "overallStatus": "PASSED",
  "overallScore": 9.75,
  "issues": [
    {
      "id": "FND-001",
      "severity": "warning",
      "category": "cmake_correctness",
      "location": "tests/render-harness/CMakeLists.txt:50",
      "description": "The render-harness JucePlugin_ManufacturerCode stub is 0x4f756172 ('Ouar'), which matches neither the release manufacturer code OuAu nor the dev code OuDv. This is a hand-written stub for compiling PluginProcessor.cpp in the headless console app, which never registers an AU/VST3 component, so the value has zero functional impact and does not block the gate. Note the sibling JucePlugin_PluginCode stub IS correct (0x4f536942 = 'OSiB').",
      "fixSuggestion": "For consistency with the project standard, update the JucePlugin_ManufacturerCode macro in the harness CMake to the OuAu/OuDv code (0x4f754175 / 0x4f754476) so the test stub mirrors the real plugin; purely cosmetic, defer freely as it affects no built artifact."
    }
  ],
  "nextAction": "gate_pass"
}
