{
  "critic": "foundation-critic",
  "plugin": "O-simpleBeatmaker",
  "stage": "3-gui",
  "attempt": 1,
  "maxAttempts": 3,
  "timestamp": "2026-06-25T00:00:00Z",
  "scores": {
    "cmake_correctness": {
      "score": 10,
      "threshold": 8,
      "passed": true,
      "details": "juce_add_plugin has all required fields: COMPANY_NAME, PLUGIN_MANUFACTURER_CODE (=${OUARICON_MANUFACTURER_CODE} -> OuDv dev / OuAu release, both valid), unique PLUGIN_CODE OSiB, FORMATS VST3 AU Standalone (VST3+AU present), IS_SYNTH TRUE (correct for a drum instrument), NEEDS_MIDI_INPUT TRUE (correct for a MIDI-driven beatmaker), NEEDS_WEB_BROWSER TRUE. Windows WebView2 config is COMPLETE: NEEDS_WEBVIEW2 TRUE (CMakeLists.txt:24) AND JUCE_USE_WIN_WEBVIEW2_WITH_STATIC_LINKING=1 (CMakeLists.txt:98) -- the project's most common WebView CMake defect is absent here. Single binary-data target O-simpleBeatmaker_UIResources with all 5 UI resource files (index.html, css/styles.css, js/app.js, js/juce/index.js, js/juce/check_native_interop.js), all verified to exist on disk; linked PRIVATE; default BinaryData namespace -- only one binary-data target so the O-simpleGrain dual-namespace collision does not apply. juce_gui_extra is linked (CMakeLists.txt:80) along with juce_audio_utils and the full JUCE module set. Generated BinaryData.h (build dir) confirms exactly 5 symbols (index_html/styles_css/app_js/index_js/check_native_interop_js) in the single namespace, matching the C++ references. Only nit: stale Stage-1 header comment (lines 5-11) still says 'No binary-data target this stage', contradicting the target added below -- documentation cleanliness only."
    },
    "apvts_integration": {
      "score": 10,
      "threshold": 7,
      "passed": true,
      "details": "createParameterLayout() present and complete: all 42 params from parameter-spec.md present -- 29 float (swing, humanize, quantizeStrength, tempo, outputLevel + per-voice Tune/Decay/Tone/Level x6 = 24), 1 choice (patternLength with StringArray {8,16,32}, default idx 1 = 16), 12 bool (per-voice Mute/Solo x6). Defaults match the contract exactly: quantizeStrength 1.0, patternLength idx1=16, voice Decay/Tone 0.5, dB params 0.0, Tune 0.0, bools false. Ranges match: unitRange 0-1, dbRange -60..0, Tune -12..+12, tempo 40-240. Param IDs are composed from BeatmakerIDs::ParamIDs + voiceParamID(), the single source of truth -- no literal drift. APVTS member 'parameters' declared (PluginProcessor.h:122) and constructed with createParameterLayout() (PluginProcessor.cpp:102). app.js param IDs cross-checked: GLOBAL_SLIDERS, VOICE_SLIDER_SUFFIX, COMBO_IDS=[patternLength], TOGGLE_IDS, and VOICES prefixes (kick/snare/clap/closedHat/openHat/tom) all map 1:1 to layout params -- ZERO app.js IDs absent from the layout, no dead controls. PluginEditor builds its relay/attachment ID lists from the same BeatmakerIDs source, so editor<->layout match by construction; jassert(param) guards each attachment. Native-fn parity holds: app.js getNativeFunction(setStep/getGrid/clearGrid/getSampleRate) all registered via withNativeFunction in PluginEditor.cpp."
    },
    "build_health": {
      "score": 10,
      "threshold": 8,
      "passed": true,
      "details": "Human confirmed clean VST3+AU+Standalone build, auval SUCCEEDED, pluginval strictness-10 SUCCESS. Corroborated by concrete artifacts in build/: libO-simpleBeatmaker_UIResources.a built and generated BinaryData.h lists exactly the 5 symbols the editor references (no missing/extra symbol, single namespace -> no duplicate-symbol risk). The 3 read-only advisory taps (getCurrentSampleRate/getLastKnownBpm/isHostSynced) are declared in PluginProcessor.h:82-84, backed by members currentSampleRate/lastKnownBpm/hostSynced (h:138-140), written once/block in processBlock (cpp:273-274), and consumed in the editor Timer (PluginEditor.cpp:121-123, 206-207) -- fully consistent, no undefined symbols. Includes resolve; index.html references (css/styles.css, js/juce/check_native_interop.js, js/app.js as modules; app.js imports ./juce/index.js) are all served by getResource. No counter-evidence found."
    },
    "module_integration": {
      "score": 9,
      "threshold": 6,
      "passed": true,
      "details": "No shared Ouaricon CODE modules are linked (no scala-tuning-engine etc.) -- integration is JUCE-only plus the project-level OuariconModules.cmake helper (included at line 3) supplying OUARICON_COMPANY_NAME / OUARICON_MANUFACTURER_CODE / OUARICON_DEV_SUFFIX (defined in the root CMakeLists.txt). target_include_directories adds Source for the header-only Stage-2 DSP spine (fastSine.h, DrumVoiceEngine.h, etc.), all listed in target_sources. No version conflicts, no module path issues. Clean."
    }
  },
  "overallStatus": "PASSED",
  "overallScore": 9.75,
  "issues": [
    {
      "id": "FND-001",
      "severity": "warning",
      "category": "cmake_correctness",
      "location": "plugins/O-simpleBeatmaker/CMakeLists.txt:5-11",
      "description": "Stale Stage-1 header comment block states 'No binary-data target this stage (avoids the O-simpleGrain dual-namespace collision until a 2nd target genuinely exists in Stage 3)' and 'No DSP yet', which now contradicts the juce_add_binary_data target added at lines 55-62 and the Stage-2 DSP spine. Documentation-only; does not affect the build.",
      "fixSuggestion": "Update the top-of-file comment to reflect Stage 3 state: a single binary-data target now exists (default BinaryData namespace is correct because it is the only such target), and the DSP spine landed in Stage 2."
    }
  ],
  "nextAction": "gate_pass"
}
